{
  "$schema": "https://json-schema.org/draft/2020-12/schema",
  "$comment": "Generated by scripts/content/generate-schemas.ts from src/shared/src/content (zod). Do not edit: run `npm run content:schemas`.",
  "title": "Course manifest",
  "description": "courses/<course-id>/course.json",
  "type": "object",
  "properties": {
    "$schema": {
      "type": "string"
    },
    "id": {
      "type": "string",
      "pattern": "^[a-z0-9]+(?:-[a-z0-9]+)*$"
    },
    "version": {
      "type": "string",
      "pattern": "^\\d+\\.\\d+\\.\\d+(?:-[0-9a-z.-]+)?$"
    },
    "locale": {
      "type": "string",
      "enum": [
        "es",
        "en"
      ]
    },
    "status": {
      "type": "string",
      "enum": [
        "draft",
        "active",
        "archived"
      ]
    },
    "title": {
      "type": "string",
      "minLength": 1
    },
    "shortTitle": {
      "type": "string",
      "minLength": 1,
      "maxLength": 40
    },
    "provider": {
      "type": "string",
      "minLength": 1
    },
    "description": {
      "type": "string",
      "minLength": 1
    },
    "level": {
      "type": "string",
      "enum": [
        "beginner",
        "intermediate",
        "advanced"
      ]
    },
    "estimatedHours": {
      "type": "number",
      "exclusiveMinimum": 0
    },
    "icon": {
      "type": "string",
      "enum": [
        "logo",
        "sliders",
        "route",
        "book",
        "terminal",
        "exam",
        "check",
        "clock",
        "translate",
        "right",
        "flag",
        "trophy",
        "bulb",
        "alert",
        "diagram",
        "logout",
        "user",
        "bot",
        "tool",
        "file",
        "server",
        "braces",
        "loop",
        "shield",
        "target",
        "list",
        "git",
        "chat",
        "layers",
        "users",
        "star",
        "flame",
        "chart",
        "cards",
        "calendar",
        "bolt",
        "undo",
        "palette",
        "globe",
        "gift",
        "crown",
        "lock",
        "play",
        "search",
        "note",
        "eye",
        "sparkle",
        "puzzle",
        "gem",
        "bag",
        "grid",
        "eyeOff",
        "mail",
        "key",
        "userPlus",
        "sun",
        "moon",
        "monitor",
        "medal"
      ]
    },
    "color": {
      "type": "string",
      "pattern": "^#[0-9a-f]{6}$"
    },
    "certification": {
      "type": "object",
      "properties": {
        "code": {
          "type": "string",
          "minLength": 1
        },
        "name": {
          "type": "string",
          "minLength": 1
        },
        "provider": {
          "type": "string",
          "minLength": 1
        },
        "officialGuideUrl": {
          "type": "string",
          "format": "uri"
        },
        "questionCount": {
          "type": "integer",
          "exclusiveMinimum": 0,
          "maximum": 9007199254740991
        },
        "durationMinutes": {
          "type": "integer",
          "exclusiveMinimum": 0,
          "maximum": 9007199254740991
        },
        "passingScore": {
          "type": "integer",
          "exclusiveMinimum": 0,
          "maximum": 9007199254740991
        },
        "scaleMin": {
          "type": "integer",
          "minimum": 0,
          "maximum": 9007199254740991
        },
        "scaleMax": {
          "type": "integer",
          "exclusiveMinimum": 0,
          "maximum": 9007199254740991
        },
        "format": {
          "type": "string",
          "minLength": 1
        },
        "priceUsd": {
          "type": "number",
          "minimum": 0
        },
        "validityMonths": {
          "type": "integer",
          "exclusiveMinimum": 0,
          "maximum": 9007199254740991
        }
      },
      "required": [
        "code",
        "name",
        "questionCount",
        "durationMinutes",
        "passingScore",
        "scaleMin",
        "scaleMax",
        "format"
      ]
    },
    "domains": {
      "minItems": 1,
      "type": "array",
      "items": {
        "type": "object",
        "properties": {
          "id": {
            "type": "string",
            "pattern": "^[a-z0-9]+(?:-[a-z0-9]+)*$"
          },
          "code": {
            "type": "string",
            "pattern": "^D\\d{1,2}$"
          },
          "name": {
            "type": "string",
            "minLength": 1
          },
          "officialName": {
            "type": "string",
            "minLength": 1
          },
          "weight": {
            "type": "number",
            "minimum": 0,
            "maximum": 100
          },
          "icon": {
            "type": "string",
            "enum": [
              "logo",
              "sliders",
              "route",
              "book",
              "terminal",
              "exam",
              "check",
              "clock",
              "translate",
              "right",
              "flag",
              "trophy",
              "bulb",
              "alert",
              "diagram",
              "logout",
              "user",
              "bot",
              "tool",
              "file",
              "server",
              "braces",
              "loop",
              "shield",
              "target",
              "list",
              "git",
              "chat",
              "layers",
              "users",
              "star",
              "flame",
              "chart",
              "cards",
              "calendar",
              "bolt",
              "undo",
              "palette",
              "globe",
              "gift",
              "crown",
              "lock",
              "play",
              "search",
              "note",
              "eye",
              "sparkle",
              "puzzle",
              "gem",
              "bag",
              "grid",
              "eyeOff",
              "mail",
              "key",
              "userPlus",
              "sun",
              "moon",
              "monitor",
              "medal"
            ]
          },
          "color": {
            "type": "string",
            "pattern": "^#[0-9a-f]{6}$"
          },
          "summary": {
            "type": "string",
            "minLength": 1
          },
          "skills": {
            "default": [],
            "type": "array",
            "items": {
              "type": "object",
              "properties": {
                "name": {
                  "type": "string",
                  "minLength": 1
                },
                "weight": {
                  "type": "number",
                  "minimum": 0,
                  "maximum": 100
                }
              },
              "required": [
                "name",
                "weight"
              ]
            }
          }
        },
        "required": [
          "id",
          "code",
          "name",
          "weight",
          "icon",
          "color",
          "summary"
        ]
      }
    },
    "units": {
      "minItems": 1,
      "type": "array",
      "items": {
        "type": "string",
        "pattern": "^[a-z0-9]+(?:-[a-z0-9]+)*$"
      }
    },
    "exams": {
      "default": [],
      "type": "array",
      "items": {
        "type": "string",
        "pattern": "^[a-z0-9]+(?:-[a-z0-9]+)*$"
      }
    },
    "glossary": {
      "type": "object",
      "properties": {
        "langs": {
          "minItems": 1,
          "type": "array",
          "items": {
            "type": "string",
            "maxLength": 35,
            "pattern": "^[a-z]{2,3}(-[A-Za-z0-9]{2,8})*$"
          }
        }
      }
    },
    "sources": {
      "default": [],
      "type": "array",
      "items": {
        "type": "object",
        "properties": {
          "title": {
            "type": "string",
            "minLength": 1
          },
          "url": {
            "type": "string",
            "format": "uri"
          }
        },
        "required": [
          "url"
        ]
      }
    },
    "achievements": {
      "default": [],
      "maxItems": 100,
      "type": "array",
      "items": {
        "type": "object",
        "properties": {
          "id": {
            "type": "string",
            "pattern": "^[a-z0-9]+(?:-[a-z0-9]+)*$"
          },
          "name": {
            "type": "string",
            "minLength": 1,
            "maxLength": 40
          },
          "description": {
            "type": "string",
            "minLength": 1,
            "maxLength": 120
          },
          "icon": {
            "type": "string",
            "enum": [
              "book",
              "layers",
              "route",
              "crown",
              "terminal",
              "tool",
              "flag",
              "star",
              "sparkle",
              "trophy",
              "exam",
              "medal",
              "cards",
              "bulb",
              "list",
              "play",
              "bolt",
              "search",
              "puzzle",
              "flame",
              "calendar",
              "target",
              "chart",
              "gift",
              "bag",
              "check",
              "shield",
              "diagram",
              "braces",
              "server",
              "bot",
              "globe",
              "key",
              "chat",
              "git",
              "loop",
              "file",
              "gem"
            ]
          },
          "color": {
            "type": "string",
            "pattern": "^#[0-9a-f]{6}$"
          },
          "rewardGems": {
            "type": "integer",
            "minimum": 15,
            "maximum": 300
          },
          "condition": {
            "oneOf": [
              {
                "type": "object",
                "properties": {
                  "type": {
                    "type": "string",
                    "const": "lessons-completed"
                  },
                  "count": {
                    "type": "integer",
                    "minimum": 1,
                    "maximum": 10000
                  }
                },
                "required": [
                  "type",
                  "count"
                ]
              },
              {
                "type": "object",
                "properties": {
                  "type": {
                    "type": "string",
                    "const": "labs-completed"
                  },
                  "count": {
                    "type": "integer",
                    "minimum": 1,
                    "maximum": 10000
                  }
                },
                "required": [
                  "type",
                  "count"
                ]
              },
              {
                "type": "object",
                "properties": {
                  "type": {
                    "type": "string",
                    "const": "unit-completed"
                  },
                  "unitId": {
                    "type": "string",
                    "pattern": "^[a-z0-9]+(?:-[a-z0-9]+)*$"
                  }
                },
                "required": [
                  "type",
                  "unitId"
                ]
              },
              {
                "type": "object",
                "properties": {
                  "type": {
                    "type": "string",
                    "const": "units-completed"
                  },
                  "count": {
                    "type": "integer",
                    "minimum": 1,
                    "maximum": 10000
                  }
                },
                "required": [
                  "type",
                  "count"
                ]
              },
              {
                "type": "object",
                "properties": {
                  "type": {
                    "type": "string",
                    "const": "domain-mastery"
                  },
                  "domainId": {
                    "type": "string",
                    "pattern": "^[a-z0-9]+(?:-[a-z0-9]+)*$"
                  },
                  "percent": {
                    "type": "integer",
                    "minimum": 50,
                    "maximum": 100
                  }
                },
                "required": [
                  "type",
                  "domainId",
                  "percent"
                ]
              },
              {
                "type": "object",
                "properties": {
                  "type": {
                    "type": "string",
                    "const": "mock-passed"
                  },
                  "examId": {
                    "type": "string",
                    "pattern": "^[a-z0-9]+(?:-[a-z0-9]+)*$"
                  }
                },
                "required": [
                  "type"
                ]
              },
              {
                "type": "object",
                "properties": {
                  "type": {
                    "type": "string",
                    "const": "mock-score"
                  },
                  "percent": {
                    "type": "integer",
                    "minimum": 50,
                    "maximum": 100
                  }
                },
                "required": [
                  "type",
                  "percent"
                ]
              },
              {
                "type": "object",
                "properties": {
                  "type": {
                    "type": "string",
                    "const": "flashcards-mastered"
                  },
                  "count": {
                    "type": "integer",
                    "minimum": 1,
                    "maximum": 10000
                  }
                },
                "required": [
                  "type",
                  "count"
                ]
              },
              {
                "type": "object",
                "properties": {
                  "type": {
                    "type": "string",
                    "const": "course-completed"
                  }
                },
                "required": [
                  "type"
                ]
              }
            ]
          }
        },
        "required": [
          "id",
          "name",
          "description",
          "icon",
          "color",
          "rewardGems",
          "condition"
        ]
      }
    }
  },
  "required": [
    "id",
    "version",
    "locale",
    "status",
    "title",
    "shortTitle",
    "provider",
    "description",
    "level",
    "estimatedHours",
    "icon",
    "color",
    "domains",
    "units"
  ]
}
